{
  "current_owner": null,
  "gsis_id": null,
  "name": "Zaven Collins",
  "ownership_history": [
    {
      "bid": 0,
      "date": "2023-07-13",
      "event": "add",
      "roster_id": 1,
      "season": 2023,
      "via": "waiver"
    },
    {
      "bid": null,
      "date": "2023-09-14",
      "event": "drop",
      "roster_id": 1,
      "season": 2023,
      "via": "waiver"
    },
    {
      "event": "rostered",
      "from_week": 1,
      "roster_id": 1,
      "season": 2023,
      "to_week": 1
    }
  ],
  "player_id": "7637",
  "position": "LB",
  "season_aggregates": {
    "2023": {
      "best_week": {
        "owner_roster_id": 1,
        "points": 6.0,
        "week": 1
      },
      "total_fantasy_pts": 6.0,
      "weeks_played": 1,
      "weeks_rostered": 1,
      "weeks_started": 1,
      "worst_week": {
        "owner_roster_id": 1,
        "points": 6.0,
        "week": 1
      }
    }
  },
  "weekly": [
    {
      "fantasy_points": 6.0,
      "game_id": null,
      "owner_roster_id": 1,
      "season": 2023,
      "started": true,
      "status": "played",
      "week": 1
    }
  ]
}
