{
  "current_owner": null,
  "gsis_id": null,
  "name": "Quentin Lake",
  "ownership_history": [
    {
      "bid": 0,
      "date": "2024-09-25",
      "event": "add",
      "roster_id": 8,
      "season": 2024,
      "via": "waiver"
    },
    {
      "bid": null,
      "date": "2024-10-30",
      "event": "drop",
      "roster_id": 8,
      "season": 2024,
      "via": "free_agent"
    },
    {
      "bid": null,
      "date": "2024-11-23",
      "event": "add",
      "roster_id": 10,
      "season": 2024,
      "via": "free_agent"
    },
    {
      "bid": null,
      "date": "2024-12-01",
      "event": "drop",
      "roster_id": 10,
      "season": 2024,
      "via": "free_agent"
    },
    {
      "event": "rostered",
      "from_week": 4,
      "roster_id": 8,
      "season": 2024,
      "to_week": 8
    },
    {
      "event": "rostered",
      "from_week": 12,
      "roster_id": 10,
      "season": 2024,
      "to_week": 12
    },
    {
      "bid": null,
      "date": "2025-11-02",
      "event": "add",
      "roster_id": 10,
      "season": 2025,
      "via": "free_agent"
    },
    {
      "bid": null,
      "date": "2025-11-18",
      "event": "drop",
      "roster_id": 10,
      "season": 2025,
      "via": "free_agent"
    },
    {
      "event": "rostered",
      "from_week": 9,
      "roster_id": 10,
      "season": 2025,
      "to_week": 11
    }
  ],
  "player_id": "8330",
  "position": "DB",
  "season_aggregates": {
    "2024": {
      "best_week": {
        "owner_roster_id": 8,
        "points": 11.0,
        "week": 4
      },
      "total_fantasy_pts": 29.5,
      "weeks_played": 5,
      "weeks_rostered": 6,
      "weeks_started": 5,
      "worst_week": {
        "owner_roster_id": 8,
        "points": 1.5,
        "week": 8
      }
    },
    "2025": {
      "best_week": {
        "owner_roster_id": 10,
        "points": 10.5,
        "week": 10
      },
      "total_fantasy_pts": 17.5,
      "weeks_played": 3,
      "weeks_rostered": 3,
      "weeks_started": 3,
      "worst_week": {
        "owner_roster_id": 10,
        "points": 3.0,
        "week": 11
      }
    }
  },
  "weekly": [
    {
      "fantasy_points": 11.0,
      "game_id": null,
      "owner_roster_id": 8,
      "season": 2024,
      "started": true,
      "status": "played",
      "week": 4
    },
    {
      "fantasy_points": 5.5,
      "game_id": null,
      "owner_roster_id": 8,
      "season": 2024,
      "started": true,
      "status": "played",
      "week": 5
    },
    {
      "fantasy_points": 0.0,
      "game_id": null,
      "owner_roster_id": 8,
      "season": 2024,
      "started": false,
      "status": "bye_week",
      "week": 6
    },
    {
      "fantasy_points": 8.0,
      "game_id": null,
      "owner_roster_id": 8,
      "season": 2024,
      "started": true,
      "status": "played",
      "week": 7
    },
    {
      "fantasy_points": 1.5,
      "game_id": null,
      "owner_roster_id": 8,
      "season": 2024,
      "started": true,
      "status": "played",
      "week": 8
    },
    {
      "fantasy_points": 3.5,
      "game_id": null,
      "owner_roster_id": 10,
      "season": 2024,
      "started": true,
      "status": "played",
      "week": 12
    },
    {
      "fantasy_points": 4.0,
      "game_id": "2025_09_NO_LA",
      "owner_roster_id": 10,
      "season": 2025,
      "started": true,
      "status": "played",
      "week": 9
    },
    {
      "fantasy_points": 10.5,
      "game_id": "2025_10_LA_SF",
      "owner_roster_id": 10,
      "season": 2025,
      "started": true,
      "status": "played",
      "week": 10
    },
    {
      "fantasy_points": 3.0,
      "game_id": "2025_11_SEA_LA",
      "owner_roster_id": 10,
      "season": 2025,
      "started": true,
      "status": "played",
      "week": 11
    }
  ]
}
