{
  "current_owner": null,
  "gsis_id": "00-0032671",
  "name": "Morgan Fox",
  "ownership_history": [
    {
      "bid": null,
      "date": "2023-12-10",
      "event": "add",
      "roster_id": 4,
      "season": 2023,
      "via": "free_agent"
    },
    {
      "bid": null,
      "date": "2023-12-10",
      "event": "drop",
      "roster_id": 4,
      "season": 2023,
      "via": "waiver"
    },
    {
      "event": "rostered",
      "from_week": 14,
      "roster_id": 4,
      "season": 2023,
      "to_week": 14
    }
  ],
  "player_id": "3743",
  "position": "DE",
  "season_aggregates": {
    "2023": {
      "best_week": {
        "owner_roster_id": 4,
        "points": 1.0,
        "week": 14
      },
      "total_fantasy_pts": 1.0,
      "weeks_played": 1,
      "weeks_rostered": 1,
      "weeks_started": 1,
      "worst_week": {
        "owner_roster_id": 4,
        "points": 1.0,
        "week": 14
      }
    }
  },
  "weekly": [
    {
      "fantasy_points": 1.0,
      "game_id": null,
      "owner_roster_id": 4,
      "season": 2023,
      "started": true,
      "status": "played",
      "week": 14
    }
  ]
}
