{
  "current_owner": null,
  "gsis_id": null,
  "name": "Travon Walker",
  "ownership_history": [
    {
      "date": "2022-09-05",
      "draft_slot": 5,
      "event": "draft",
      "pick": 269,
      "roster_id": 2,
      "round": 23,
      "season": 2022
    },
    {
      "event": "rostered",
      "from_week": 1,
      "roster_id": 2,
      "season": 2022,
      "to_week": 18
    },
    {
      "bid": null,
      "date": "2023-09-06",
      "event": "drop",
      "roster_id": 2,
      "season": 2023,
      "via": "free_agent"
    },
    {
      "bid": null,
      "date": "2024-09-12",
      "event": "add",
      "roster_id": 12,
      "season": 2024,
      "via": "free_agent"
    },
    {
      "bid": null,
      "date": "2024-10-02",
      "event": "drop",
      "roster_id": 12,
      "season": 2024,
      "via": "free_agent"
    },
    {
      "bid": null,
      "date": "2024-10-12",
      "event": "add",
      "roster_id": 12,
      "season": 2024,
      "via": "free_agent"
    },
    {
      "event": "rostered",
      "from_week": 2,
      "roster_id": 12,
      "season": 2024,
      "to_week": 4
    },
    {
      "event": "rostered",
      "from_week": 6,
      "roster_id": 12,
      "season": 2024,
      "to_week": 18
    },
    {
      "bid": null,
      "date": "2025-09-11",
      "event": "drop",
      "roster_id": 12,
      "season": 2025,
      "via": "free_agent"
    },
    {
      "event": "rostered",
      "from_week": 1,
      "roster_id": 12,
      "season": 2025,
      "to_week": 1
    }
  ],
  "player_id": "8265",
  "position": "LB",
  "season_aggregates": {
    "2022": {
      "best_week": {
        "owner_roster_id": 2,
        "points": 11.5,
        "week": 1
      },
      "total_fantasy_pts": 60.5,
      "weeks_played": 15,
      "weeks_rostered": 18,
      "weeks_started": 0,
      "worst_week": {
        "owner_roster_id": 2,
        "points": 0.0,
        "week": 17
      }
    },
    "2024": {
      "best_week": {
        "owner_roster_id": 12,
        "points": 17.5,
        "week": 9
      },
      "total_fantasy_pts": 91.0,
      "weeks_played": 15,
      "weeks_rostered": 16,
      "weeks_started": 15,
      "worst_week": {
        "owner_roster_id": 12,
        "points": 0.5,
        "week": 6
      }
    },
    "2025": {
      "best_week": {
        "owner_roster_id": 12,
        "points": 1.5,
        "week": 1
      },
      "total_fantasy_pts": 1.5,
      "weeks_played": 1,
      "weeks_rostered": 1,
      "weeks_started": 1,
      "worst_week": {
        "owner_roster_id": 12,
        "points": 1.5,
        "week": 1
      }
    }
  },
  "weekly": [
    {
      "fantasy_points": 11.5,
      "game_id": null,
      "owner_roster_id": 2,
      "season": 2022,
      "started": false,
      "status": "played",
      "week": 1
    },
    {
      "fantasy_points": 2.0,
      "game_id": null,
      "owner_roster_id": 2,
      "season": 2022,
      "started": false,
      "status": "played",
      "week": 2
    },
    {
      "fantasy_points": 2.0,
      "game_id": null,
      "owner_roster_id": 2,
      "season": 2022,
      "started": false,
      "status": "played",
      "week": 3
    },
    {
      "fantasy_points": 6.0,
      "game_id": null,
      "owner_roster_id": 2,
      "season": 2022,
      "started": false,
      "status": "played",
      "week": 4
    },
    {
      "fantasy_points": 4.0,
      "game_id": null,
      "owner_roster_id": 2,
      "season": 2022,
      "started": false,
      "status": "played",
      "week": 5
    },
    {
      "fantasy_points": 2.5,
      "game_id": null,
      "owner_roster_id": 2,
      "season": 2022,
      "started": false,
      "status": "played",
      "week": 6
    },
    {
      "fantasy_points": 7.5,
      "game_id": null,
      "owner_roster_id": 2,
      "season": 2022,
      "started": false,
      "status": "played",
      "week": 7
    },
    {
      "fantasy_points": 4.0,
      "game_id": null,
      "owner_roster_id": 2,
      "season": 2022,
      "started": false,
      "status": "played",
      "week": 8
    },
    {
      "fantasy_points": 2.0,
      "game_id": null,
      "owner_roster_id": 2,
      "season": 2022,
      "started": false,
      "status": "played",
      "week": 9
    },
    {
      "fantasy_points": 1.5,
      "game_id": null,
      "owner_roster_id": 2,
      "season": 2022,
      "started": false,
      "status": "played",
      "week": 10
    },
    {
      "fantasy_points": 0.0,
      "game_id": null,
      "owner_roster_id": 2,
      "season": 2022,
      "started": false,
      "status": "bye_week",
      "week": 11
    },
    {
      "fantasy_points": 0.5,
      "game_id": null,
      "owner_roster_id": 2,
      "season": 2022,
      "started": false,
      "status": "played",
      "week": 12
    },
    {
      "fantasy_points": 5.5,
      "game_id": null,
      "owner_roster_id": 2,
      "season": 2022,
      "started": false,
      "status": "played",
      "week": 13
    },
    {
      "fantasy_points": 6.5,
      "game_id": null,
      "owner_roster_id": 2,
      "season": 2022,
      "started": false,
      "status": "played",
      "week": 14
    },
    {
      "fantasy_points": 0.0,
      "game_id": null,
      "owner_roster_id": 2,
      "season": 2022,
      "started": false,
      "status": "did_not_play",
      "week": 15
    },
    {
      "fantasy_points": 0.0,
      "game_id": null,
      "owner_roster_id": 2,
      "season": 2022,
      "started": false,
      "status": "did_not_play",
      "week": 16
    },
    {
      "fantasy_points": 0.0,
      "game_id": null,
      "owner_roster_id": 2,
      "season": 2022,
      "started": false,
      "status": "played",
      "week": 17
    },
    {
      "fantasy_points": 5.0,
      "game_id": null,
      "owner_roster_id": 2,
      "season": 2022,
      "started": false,
      "status": "played",
      "week": 18
    },
    {
      "fantasy_points": 2.5,
      "game_id": null,
      "owner_roster_id": 12,
      "season": 2024,
      "started": true,
      "status": "played",
      "week": 2
    },
    {
      "fantasy_points": 4.5,
      "game_id": null,
      "owner_roster_id": 12,
      "season": 2024,
      "started": true,
      "status": "played",
      "week": 3
    },
    {
      "fantasy_points": 1.5,
      "game_id": null,
      "owner_roster_id": 12,
      "season": 2024,
      "started": true,
      "status": "played",
      "week": 4
    },
    {
      "fantasy_points": 0.5,
      "game_id": null,
      "owner_roster_id": 12,
      "season": 2024,
      "started": true,
      "status": "played",
      "week": 6
    },
    {
      "fantasy_points": 8.5,
      "game_id": null,
      "owner_roster_id": 12,
      "season": 2024,
      "started": true,
      "status": "played",
      "week": 7
    },
    {
      "fantasy_points": 5.0,
      "game_id": null,
      "owner_roster_id": 12,
      "season": 2024,
      "started": true,
      "status": "played",
      "week": 8
    },
    {
      "fantasy_points": 17.5,
      "game_id": null,
      "owner_roster_id": 12,
      "season": 2024,
      "started": true,
      "status": "played",
      "week": 9
    },
    {
      "fantasy_points": 9.0,
      "game_id": null,
      "owner_roster_id": 12,
      "season": 2024,
      "started": true,
      "status": "played",
      "week": 10
    },
    {
      "fantasy_points": 2.0,
      "game_id": null,
      "owner_roster_id": 12,
      "season": 2024,
      "started": true,
      "status": "played",
      "week": 11
    },
    {
      "fantasy_points": 0.0,
      "game_id": null,
      "owner_roster_id": 12,
      "season": 2024,
      "started": false,
      "status": "bye_week",
      "week": 12
    },
    {
      "fantasy_points": 8.5,
      "game_id": null,
      "owner_roster_id": 12,
      "season": 2024,
      "started": true,
      "status": "played",
      "week": 13
    },
    {
      "fantasy_points": 3.5,
      "game_id": null,
      "owner_roster_id": 12,
      "season": 2024,
      "started": true,
      "status": "played",
      "week": 14
    },
    {
      "fantasy_points": 3.5,
      "game_id": null,
      "owner_roster_id": 12,
      "season": 2024,
      "started": true,
      "status": "played",
      "week": 15
    },
    {
      "fantasy_points": 4.5,
      "game_id": null,
      "owner_roster_id": 12,
      "season": 2024,
      "started": true,
      "status": "played",
      "week": 16
    },
    {
      "fantasy_points": 10.5,
      "game_id": null,
      "owner_roster_id": 12,
      "season": 2024,
      "started": true,
      "status": "played",
      "week": 17
    },
    {
      "fantasy_points": 9.5,
      "game_id": null,
      "owner_roster_id": 12,
      "season": 2024,
      "started": true,
      "status": "played",
      "week": 18
    },
    {
      "fantasy_points": 1.5,
      "game_id": "2025_01_CAR_JAX",
      "owner_roster_id": 12,
      "season": 2025,
      "started": true,
      "status": "played",
      "week": 1
    }
  ]
}
