{
  "current_owner": null,
  "gsis_id": null,
  "name": "Daiyan Henley",
  "ownership_history": [
    {
      "bid": 0,
      "date": "2024-11-20",
      "event": "add",
      "roster_id": 1,
      "season": 2024,
      "via": "waiver"
    },
    {
      "event": "rostered",
      "from_week": 12,
      "roster_id": 1,
      "season": 2024,
      "to_week": 18
    },
    {
      "bid": null,
      "date": "2025-10-21",
      "event": "drop",
      "roster_id": 1,
      "season": 2025,
      "via": "waiver"
    },
    {
      "event": "rostered",
      "from_week": 1,
      "roster_id": 1,
      "season": 2025,
      "to_week": 7
    }
  ],
  "player_id": "10914",
  "position": "LB",
  "season_aggregates": {
    "2024": {
      "best_week": {
        "owner_roster_id": 1,
        "points": 10.5,
        "week": 16
      },
      "total_fantasy_pts": 54.0,
      "weeks_played": 7,
      "weeks_rostered": 7,
      "weeks_started": 7,
      "worst_week": {
        "owner_roster_id": 1,
        "points": 0.0,
        "week": 17
      }
    },
    "2025": {
      "best_week": {
        "owner_roster_id": 1,
        "points": 23.5,
        "week": 2
      },
      "total_fantasy_pts": 57.5,
      "weeks_played": 7,
      "weeks_rostered": 7,
      "weeks_started": 6,
      "worst_week": {
        "owner_roster_id": 1,
        "points": 1.0,
        "week": 7
      }
    }
  },
  "weekly": [
    {
      "fantasy_points": 9.0,
      "game_id": null,
      "owner_roster_id": 1,
      "season": 2024,
      "started": true,
      "status": "played",
      "week": 12
    },
    {
      "fantasy_points": 8.5,
      "game_id": null,
      "owner_roster_id": 1,
      "season": 2024,
      "started": true,
      "status": "played",
      "week": 13
    },
    {
      "fantasy_points": 9.0,
      "game_id": null,
      "owner_roster_id": 1,
      "season": 2024,
      "started": true,
      "status": "played",
      "week": 14
    },
    {
      "fantasy_points": 8.5,
      "game_id": null,
      "owner_roster_id": 1,
      "season": 2024,
      "started": true,
      "status": "played",
      "week": 15
    },
    {
      "fantasy_points": 10.5,
      "game_id": null,
      "owner_roster_id": 1,
      "season": 2024,
      "started": true,
      "status": "played",
      "week": 16
    },
    {
      "fantasy_points": 0.0,
      "game_id": null,
      "owner_roster_id": 1,
      "season": 2024,
      "started": true,
      "status": "played",
      "week": 17
    },
    {
      "fantasy_points": 8.5,
      "game_id": null,
      "owner_roster_id": 1,
      "season": 2024,
      "started": true,
      "status": "played",
      "week": 18
    },
    {
      "fantasy_points": 11.5,
      "game_id": "2025_01_KC_LAC",
      "owner_roster_id": 1,
      "season": 2025,
      "started": true,
      "status": "played",
      "week": 1
    },
    {
      "fantasy_points": 23.5,
      "game_id": "2025_02_LAC_LV",
      "owner_roster_id": 1,
      "season": 2025,
      "started": true,
      "status": "played",
      "week": 2
    },
    {
      "fantasy_points": 3.0,
      "game_id": "2025_03_DEN_LAC",
      "owner_roster_id": 1,
      "season": 2025,
      "started": true,
      "status": "played",
      "week": 3
    },
    {
      "fantasy_points": 8.5,
      "game_id": "2025_04_LAC_NYG",
      "owner_roster_id": 1,
      "season": 2025,
      "started": true,
      "status": "played",
      "week": 4
    },
    {
      "fantasy_points": 5.0,
      "game_id": "2025_05_WAS_LAC",
      "owner_roster_id": 1,
      "season": 2025,
      "started": true,
      "status": "played",
      "week": 5
    },
    {
      "fantasy_points": 5.0,
      "game_id": "2025_06_LAC_MIA",
      "owner_roster_id": 1,
      "season": 2025,
      "started": true,
      "status": "played",
      "week": 6
    },
    {
      "fantasy_points": 1.0,
      "game_id": "2025_07_IND_LAC",
      "owner_roster_id": 1,
      "season": 2025,
      "started": false,
      "status": "played",
      "week": 7
    }
  ]
}
