{
  "current_owner": {
    "roster_id": 7,
    "team_name": "Chudders Football Team"
  },
  "gsis_id": null,
  "name": "Jaylin Noel",
  "ownership_history": [
    {
      "date": "2025-07-10",
      "draft_slot": 11,
      "event": "draft",
      "pick": 23,
      "roster_id": 7,
      "round": 2,
      "season": 2025
    },
    {
      "event": "rostered",
      "from_week": 1,
      "roster_id": 7,
      "season": 2025,
      "to_week": 18
    }
  ],
  "player_id": "12536",
  "position": "WR",
  "season_aggregates": {
    "2025": {
      "best_week": {
        "owner_roster_id": 7,
        "points": 13.1,
        "week": 17
      },
      "total_fantasy_pts": 55.4,
      "weeks_played": 17,
      "weeks_rostered": 18,
      "weeks_started": 0,
      "worst_week": {
        "owner_roster_id": 7,
        "points": -0.3,
        "week": 9
      }
    }
  },
  "weekly": [
    {
      "fantasy_points": 1.2,
      "game_id": "2025_01_HOU_LA",
      "owner_roster_id": 7,
      "season": 2025,
      "started": false,
      "status": "played",
      "week": 1
    },
    {
      "fantasy_points": 0.0,
      "game_id": "2025_02_TB_HOU",
      "owner_roster_id": 7,
      "season": 2025,
      "started": false,
      "status": "played",
      "week": 2
    },
    {
      "fantasy_points": 0.9,
      "game_id": "2025_03_HOU_JAX",
      "owner_roster_id": 7,
      "season": 2025,
      "started": false,
      "status": "played",
      "week": 3
    },
    {
      "fantasy_points": 0.5,
      "game_id": "2025_04_TEN_HOU",
      "owner_roster_id": 7,
      "season": 2025,
      "started": false,
      "status": "played",
      "week": 4
    },
    {
      "fantasy_points": 8.8,
      "game_id": "2025_05_HOU_BAL",
      "owner_roster_id": 7,
      "season": 2025,
      "started": false,
      "status": "played",
      "week": 5
    },
    {
      "fantasy_points": 0.0,
      "game_id": null,
      "owner_roster_id": 7,
      "season": 2025,
      "started": false,
      "status": "bye_week",
      "week": 6
    },
    {
      "fantasy_points": 9.7,
      "game_id": "2025_07_HOU_SEA",
      "owner_roster_id": 7,
      "season": 2025,
      "started": false,
      "status": "played",
      "week": 7
    },
    {
      "fantasy_points": 8.8,
      "game_id": "2025_08_SF_HOU",
      "owner_roster_id": 7,
      "season": 2025,
      "started": false,
      "status": "played",
      "week": 8
    },
    {
      "fantasy_points": -0.3,
      "game_id": "2025_09_DEN_HOU",
      "owner_roster_id": 7,
      "season": 2025,
      "started": false,
      "status": "played",
      "week": 9
    },
    {
      "fantasy_points": 5.5,
      "game_id": "2025_10_JAX_HOU",
      "owner_roster_id": 7,
      "season": 2025,
      "started": false,
      "status": "played",
      "week": 10
    },
    {
      "fantasy_points": 1.7,
      "game_id": "2025_11_HOU_TEN",
      "owner_roster_id": 7,
      "season": 2025,
      "started": false,
      "status": "played",
      "week": 11
    },
    {
      "fantasy_points": 1.4,
      "game_id": "2025_12_BUF_HOU",
      "owner_roster_id": 7,
      "season": 2025,
      "started": false,
      "status": "played",
      "week": 12
    },
    {
      "fantasy_points": 0.0,
      "game_id": "2025_13_HOU_IND",
      "owner_roster_id": 7,
      "season": 2025,
      "started": false,
      "status": "played",
      "week": 13
    },
    {
      "fantasy_points": 2.3,
      "game_id": "2025_14_HOU_KC",
      "owner_roster_id": 7,
      "season": 2025,
      "started": false,
      "status": "played",
      "week": 14
    },
    {
      "fantasy_points": 0.0,
      "game_id": "2025_15_ARI_HOU",
      "owner_roster_id": 7,
      "season": 2025,
      "started": false,
      "status": "played",
      "week": 15
    },
    {
      "fantasy_points": 0.0,
      "game_id": "2025_16_LV_HOU",
      "owner_roster_id": 7,
      "season": 2025,
      "started": false,
      "status": "played",
      "week": 16
    },
    {
      "fantasy_points": 13.1,
      "game_id": "2025_17_HOU_LAC",
      "owner_roster_id": 7,
      "season": 2025,
      "started": false,
      "status": "played",
      "week": 17
    },
    {
      "fantasy_points": 1.8,
      "game_id": "2025_18_IND_HOU",
      "owner_roster_id": 7,
      "season": 2025,
      "started": false,
      "status": "played",
      "week": 18
    }
  ]
}
