{
  "current_owner": null,
  "gsis_id": null,
  "name": "Justin Shorter",
  "ownership_history": [
    {
      "date": "2023-09-06",
      "draft_slot": 7,
      "event": "draft",
      "pick": 55,
      "roster_id": 1,
      "round": 5,
      "season": 2023
    },
    {
      "event": "rostered",
      "from_week": 1,
      "roster_id": 1,
      "season": 2023,
      "to_week": 18
    },
    {
      "bid": null,
      "date": "2024-09-01",
      "event": "drop",
      "roster_id": 1,
      "season": 2024,
      "via": "free_agent"
    }
  ],
  "player_id": "9489",
  "position": "WR",
  "season_aggregates": {
    "2023": {
      "best_week": {
        "owner_roster_id": 1,
        "points": 0.0,
        "week": 1
      },
      "total_fantasy_pts": 0.0,
      "weeks_played": 17,
      "weeks_rostered": 18,
      "weeks_started": 0,
      "worst_week": {
        "owner_roster_id": 1,
        "points": 0.0,
        "week": 1
      }
    }
  },
  "weekly": [
    {
      "fantasy_points": 0.0,
      "game_id": null,
      "owner_roster_id": 1,
      "season": 2023,
      "started": false,
      "status": "played",
      "week": 1
    },
    {
      "fantasy_points": 0.0,
      "game_id": null,
      "owner_roster_id": 1,
      "season": 2023,
      "started": false,
      "status": "played",
      "week": 2
    },
    {
      "fantasy_points": 0.0,
      "game_id": null,
      "owner_roster_id": 1,
      "season": 2023,
      "started": false,
      "status": "played",
      "week": 3
    },
    {
      "fantasy_points": 0.0,
      "game_id": null,
      "owner_roster_id": 1,
      "season": 2023,
      "started": false,
      "status": "played",
      "week": 4
    },
    {
      "fantasy_points": 0.0,
      "game_id": null,
      "owner_roster_id": 1,
      "season": 2023,
      "started": false,
      "status": "played",
      "week": 5
    },
    {
      "fantasy_points": 0.0,
      "game_id": null,
      "owner_roster_id": 1,
      "season": 2023,
      "started": false,
      "status": "played",
      "week": 6
    },
    {
      "fantasy_points": 0.0,
      "game_id": null,
      "owner_roster_id": 1,
      "season": 2023,
      "started": false,
      "status": "played",
      "week": 7
    },
    {
      "fantasy_points": 0.0,
      "game_id": null,
      "owner_roster_id": 1,
      "season": 2023,
      "started": false,
      "status": "played",
      "week": 8
    },
    {
      "fantasy_points": 0.0,
      "game_id": null,
      "owner_roster_id": 1,
      "season": 2023,
      "started": false,
      "status": "played",
      "week": 9
    },
    {
      "fantasy_points": 0.0,
      "game_id": null,
      "owner_roster_id": 1,
      "season": 2023,
      "started": false,
      "status": "played",
      "week": 10
    },
    {
      "fantasy_points": 0.0,
      "game_id": null,
      "owner_roster_id": 1,
      "season": 2023,
      "started": false,
      "status": "played",
      "week": 11
    },
    {
      "fantasy_points": 0.0,
      "game_id": null,
      "owner_roster_id": 1,
      "season": 2023,
      "started": false,
      "status": "played",
      "week": 12
    },
    {
      "fantasy_points": 0.0,
      "game_id": null,
      "owner_roster_id": 1,
      "season": 2023,
      "started": false,
      "status": "bye_week",
      "week": 13
    },
    {
      "fantasy_points": 0.0,
      "game_id": null,
      "owner_roster_id": 1,
      "season": 2023,
      "started": false,
      "status": "played",
      "week": 14
    },
    {
      "fantasy_points": 0.0,
      "game_id": null,
      "owner_roster_id": 1,
      "season": 2023,
      "started": false,
      "status": "played",
      "week": 15
    },
    {
      "fantasy_points": 0.0,
      "game_id": null,
      "owner_roster_id": 1,
      "season": 2023,
      "started": false,
      "status": "played",
      "week": 16
    },
    {
      "fantasy_points": 0.0,
      "game_id": null,
      "owner_roster_id": 1,
      "season": 2023,
      "started": false,
      "status": "played",
      "week": 17
    },
    {
      "fantasy_points": 0.0,
      "game_id": null,
      "owner_roster_id": 1,
      "season": 2023,
      "started": false,
      "status": "played",
      "week": 18
    }
  ]
}
