{
  "current_owner": null,
  "gsis_id": " 00-0035567",
  "name": "Craig Reynolds",
  "ownership_history": [
    {
      "bid": null,
      "date": "2022-09-28",
      "event": "add",
      "roster_id": 10,
      "season": 2022,
      "via": "free_agent"
    },
    {
      "bid": null,
      "date": "2022-10-05",
      "event": "drop",
      "roster_id": 10,
      "season": 2022,
      "via": "waiver"
    },
    {
      "bid": null,
      "date": "2022-10-13",
      "event": "add",
      "roster_id": 1,
      "season": 2022,
      "via": "free_agent"
    },
    {
      "bid": null,
      "date": "2022-10-28",
      "event": "drop",
      "roster_id": 1,
      "season": 2022,
      "via": "free_agent"
    },
    {
      "event": "rostered",
      "from_week": 4,
      "roster_id": 10,
      "season": 2022,
      "to_week": 4
    },
    {
      "event": "rostered",
      "from_week": 6,
      "roster_id": 1,
      "season": 2022,
      "to_week": 7
    },
    {
      "bid": null,
      "date": "2023-09-24",
      "event": "add",
      "roster_id": 2,
      "season": 2023,
      "via": "free_agent"
    },
    {
      "bid": null,
      "date": "2023-10-07",
      "event": "drop",
      "roster_id": 2,
      "season": 2023,
      "via": "free_agent"
    },
    {
      "bid": null,
      "date": "2023-10-13",
      "event": "add",
      "roster_id": 1,
      "season": 2023,
      "via": "free_agent"
    },
    {
      "bid": null,
      "date": "2023-11-15",
      "event": "drop",
      "roster_id": 1,
      "season": 2023,
      "via": "free_agent"
    },
    {
      "event": "rostered",
      "from_week": 3,
      "roster_id": 2,
      "season": 2023,
      "to_week": 4
    },
    {
      "event": "rostered",
      "from_week": 6,
      "roster_id": 1,
      "season": 2023,
      "to_week": 10
    },
    {
      "bid": 0,
      "date": "2024-12-17",
      "event": "add",
      "roster_id": 8,
      "season": 2024,
      "via": "waiver"
    },
    {
      "bid": null,
      "date": "2024-12-25",
      "event": "drop",
      "roster_id": 8,
      "season": 2024,
      "via": "free_agent"
    },
    {
      "event": "rostered",
      "from_week": 16,
      "roster_id": 8,
      "season": 2024,
      "to_week": 16
    },
    {
      "event": "rostered",
      "from_week": 18,
      "roster_id": 8,
      "season": 2024,
      "to_week": 18
    }
  ],
  "player_id": "6659",
  "position": "RB",
  "season_aggregates": {
    "2022": {
      "best_week": {
        "owner_roster_id": 10,
        "points": 4.7,
        "week": 4
      },
      "total_fantasy_pts": 9.2,
      "weeks_played": 2,
      "weeks_rostered": 3,
      "weeks_started": 1,
      "worst_week": {
        "owner_roster_id": 1,
        "points": 4.5,
        "week": 7
      }
    },
    "2023": {
      "best_week": {
        "owner_roster_id": 1,
        "points": 6.1,
        "week": 8
      },
      "total_fantasy_pts": 15.9,
      "weeks_played": 6,
      "weeks_rostered": 7,
      "weeks_started": 0,
      "worst_week": {
        "owner_roster_id": 2,
        "points": 0.0,
        "week": 4
      }
    },
    "2024": {
      "best_week": {
        "owner_roster_id": 8,
        "points": 4.4,
        "week": 18
      },
      "total_fantasy_pts": 7.2,
      "weeks_played": 2,
      "weeks_rostered": 2,
      "weeks_started": 0,
      "worst_week": {
        "owner_roster_id": 8,
        "points": 2.8,
        "week": 16
      }
    }
  },
  "weekly": [
    {
      "fantasy_points": 4.7,
      "game_id": null,
      "owner_roster_id": 10,
      "season": 2022,
      "started": true,
      "status": "played",
      "week": 4
    },
    {
      "fantasy_points": 0.0,
      "game_id": null,
      "owner_roster_id": 1,
      "season": 2022,
      "started": false,
      "status": "bye_week",
      "week": 6
    },
    {
      "fantasy_points": 4.5,
      "game_id": null,
      "owner_roster_id": 1,
      "season": 2022,
      "started": false,
      "status": "played",
      "week": 7
    },
    {
      "fantasy_points": 1.5,
      "game_id": null,
      "owner_roster_id": 2,
      "season": 2023,
      "started": false,
      "status": "played",
      "week": 3
    },
    {
      "fantasy_points": 0.0,
      "game_id": null,
      "owner_roster_id": 2,
      "season": 2023,
      "started": false,
      "status": "played",
      "week": 4
    },
    {
      "fantasy_points": 5.3,
      "game_id": null,
      "owner_roster_id": 1,
      "season": 2023,
      "started": false,
      "status": "played",
      "week": 6
    },
    {
      "fantasy_points": 3.0,
      "game_id": null,
      "owner_roster_id": 1,
      "season": 2023,
      "started": false,
      "status": "played",
      "week": 7
    },
    {
      "fantasy_points": 6.1,
      "game_id": null,
      "owner_roster_id": 1,
      "season": 2023,
      "started": false,
      "status": "played",
      "week": 8
    },
    {
      "fantasy_points": 0.0,
      "game_id": null,
      "owner_roster_id": 1,
      "season": 2023,
      "started": false,
      "status": "bye_week",
      "week": 9
    },
    {
      "fantasy_points": 0.0,
      "game_id": null,
      "owner_roster_id": 1,
      "season": 2023,
      "started": false,
      "status": "played",
      "week": 10
    },
    {
      "fantasy_points": 2.8,
      "game_id": null,
      "owner_roster_id": 8,
      "season": 2024,
      "started": false,
      "status": "played",
      "week": 16
    },
    {
      "fantasy_points": 4.4,
      "game_id": null,
      "owner_roster_id": 8,
      "season": 2024,
      "started": false,
      "status": "played",
      "week": 18
    }
  ]
}
