{
  "current_owner": {
    "roster_id": 10,
    "team_name": "General Ken-obi"
  },
  "gsis_id": null,
  "name": "J.J. McCarthy",
  "ownership_history": [
    {
      "date": "2024-08-25",
      "draft_slot": 12,
      "event": "draft",
      "pick": 48,
      "roster_id": 10,
      "round": 4,
      "season": 2024
    },
    {
      "event": "rostered",
      "from_week": 1,
      "roster_id": 10,
      "season": 2024,
      "to_week": 18
    },
    {
      "event": "rostered",
      "from_week": 1,
      "roster_id": 10,
      "season": 2025,
      "to_week": 18
    }
  ],
  "player_id": "11565",
  "position": "QB",
  "season_aggregates": {
    "2024": {
      "best_week": {
        "owner_roster_id": 10,
        "points": 0.0,
        "week": 1
      },
      "total_fantasy_pts": 0.0,
      "weeks_played": 17,
      "weeks_rostered": 18,
      "weeks_started": 0,
      "worst_week": {
        "owner_roster_id": 10,
        "points": 0.0,
        "week": 1
      }
    },
    "2025": {
      "best_week": {
        "owner_roster_id": 10,
        "points": 24.5,
        "week": 15
      },
      "total_fantasy_pts": 133.38,
      "weeks_played": 10,
      "weeks_rostered": 18,
      "weeks_started": 1,
      "worst_week": {
        "owner_roster_id": 10,
        "points": 1.48,
        "week": 12
      }
    }
  },
  "weekly": [
    {
      "fantasy_points": 0.0,
      "game_id": null,
      "owner_roster_id": 10,
      "season": 2024,
      "started": false,
      "status": "played",
      "week": 1
    },
    {
      "fantasy_points": 0.0,
      "game_id": null,
      "owner_roster_id": 10,
      "season": 2024,
      "started": false,
      "status": "played",
      "week": 2
    },
    {
      "fantasy_points": 0.0,
      "game_id": null,
      "owner_roster_id": 10,
      "season": 2024,
      "started": false,
      "status": "played",
      "week": 3
    },
    {
      "fantasy_points": 0.0,
      "game_id": null,
      "owner_roster_id": 10,
      "season": 2024,
      "started": false,
      "status": "played",
      "week": 4
    },
    {
      "fantasy_points": 0.0,
      "game_id": null,
      "owner_roster_id": 10,
      "season": 2024,
      "started": false,
      "status": "played",
      "week": 5
    },
    {
      "fantasy_points": 0.0,
      "game_id": null,
      "owner_roster_id": 10,
      "season": 2024,
      "started": false,
      "status": "bye_week",
      "week": 6
    },
    {
      "fantasy_points": 0.0,
      "game_id": null,
      "owner_roster_id": 10,
      "season": 2024,
      "started": false,
      "status": "played",
      "week": 7
    },
    {
      "fantasy_points": 0.0,
      "game_id": null,
      "owner_roster_id": 10,
      "season": 2024,
      "started": false,
      "status": "played",
      "week": 8
    },
    {
      "fantasy_points": 0.0,
      "game_id": null,
      "owner_roster_id": 10,
      "season": 2024,
      "started": false,
      "status": "played",
      "week": 9
    },
    {
      "fantasy_points": 0.0,
      "game_id": null,
      "owner_roster_id": 10,
      "season": 2024,
      "started": false,
      "status": "played",
      "week": 10
    },
    {
      "fantasy_points": 0.0,
      "game_id": null,
      "owner_roster_id": 10,
      "season": 2024,
      "started": false,
      "status": "played",
      "week": 11
    },
    {
      "fantasy_points": 0.0,
      "game_id": null,
      "owner_roster_id": 10,
      "season": 2024,
      "started": false,
      "status": "played",
      "week": 12
    },
    {
      "fantasy_points": 0.0,
      "game_id": null,
      "owner_roster_id": 10,
      "season": 2024,
      "started": false,
      "status": "played",
      "week": 13
    },
    {
      "fantasy_points": 0.0,
      "game_id": null,
      "owner_roster_id": 10,
      "season": 2024,
      "started": false,
      "status": "played",
      "week": 14
    },
    {
      "fantasy_points": 0.0,
      "game_id": null,
      "owner_roster_id": 10,
      "season": 2024,
      "started": false,
      "status": "played",
      "week": 15
    },
    {
      "fantasy_points": 0.0,
      "game_id": null,
      "owner_roster_id": 10,
      "season": 2024,
      "started": false,
      "status": "played",
      "week": 16
    },
    {
      "fantasy_points": 0.0,
      "game_id": null,
      "owner_roster_id": 10,
      "season": 2024,
      "started": false,
      "status": "played",
      "week": 17
    },
    {
      "fantasy_points": 0.0,
      "game_id": null,
      "owner_roster_id": 10,
      "season": 2024,
      "started": false,
      "status": "played",
      "week": 18
    },
    {
      "fantasy_points": 23.22,
      "game_id": "2025_01_MIN_CHI",
      "owner_roster_id": 10,
      "season": 2025,
      "started": false,
      "status": "played",
      "week": 1
    },
    {
      "fantasy_points": 2.82,
      "game_id": "2025_02_ATL_MIN",
      "owner_roster_id": 10,
      "season": 2025,
      "started": false,
      "status": "played",
      "week": 2
    },
    {
      "fantasy_points": 0.0,
      "game_id": "2025_03_CIN_MIN",
      "owner_roster_id": 10,
      "season": 2025,
      "started": false,
      "status": "did_not_play",
      "week": 3
    },
    {
      "fantasy_points": 0.0,
      "game_id": "2025_04_MIN_PIT",
      "owner_roster_id": 10,
      "season": 2025,
      "started": false,
      "status": "did_not_play",
      "week": 4
    },
    {
      "fantasy_points": 0.0,
      "game_id": "2025_05_MIN_CLE",
      "owner_roster_id": 10,
      "season": 2025,
      "started": false,
      "status": "did_not_play",
      "week": 5
    },
    {
      "fantasy_points": 0.0,
      "game_id": null,
      "owner_roster_id": 10,
      "season": 2025,
      "started": false,
      "status": "bye_week",
      "week": 6
    },
    {
      "fantasy_points": 0.0,
      "game_id": "2025_07_PHI_MIN",
      "owner_roster_id": 10,
      "season": 2025,
      "started": false,
      "status": "did_not_play",
      "week": 7
    },
    {
      "fantasy_points": 0.0,
      "game_id": "2025_08_MIN_LAC",
      "owner_roster_id": 10,
      "season": 2025,
      "started": false,
      "status": "did_not_play",
      "week": 8
    },
    {
      "fantasy_points": 18.92,
      "game_id": "2025_09_MIN_DET",
      "owner_roster_id": 10,
      "season": 2025,
      "started": false,
      "status": "played",
      "week": 9
    },
    {
      "fantasy_points": 16.72,
      "game_id": "2025_10_BAL_MIN",
      "owner_roster_id": 10,
      "season": 2025,
      "started": false,
      "status": "played",
      "week": 10
    },
    {
      "fantasy_points": 8.0,
      "game_id": "2025_11_CHI_MIN",
      "owner_roster_id": 10,
      "season": 2025,
      "started": false,
      "status": "played",
      "week": 11
    },
    {
      "fantasy_points": 1.48,
      "game_id": "2025_12_MIN_GB",
      "owner_roster_id": 10,
      "season": 2025,
      "started": false,
      "status": "played",
      "week": 12
    },
    {
      "fantasy_points": 0.0,
      "game_id": "2025_13_MIN_SEA",
      "owner_roster_id": 10,
      "season": 2025,
      "started": false,
      "status": "did_not_play",
      "week": 13
    },
    {
      "fantasy_points": 20.42,
      "game_id": "2025_14_WAS_MIN",
      "owner_roster_id": 10,
      "season": 2025,
      "started": false,
      "status": "played",
      "week": 14
    },
    {
      "fantasy_points": 24.5,
      "game_id": "2025_15_MIN_DAL",
      "owner_roster_id": 10,
      "season": 2025,
      "started": true,
      "status": "played",
      "week": 15
    },
    {
      "fantasy_points": 9.32,
      "game_id": "2025_16_MIN_NYG",
      "owner_roster_id": 10,
      "season": 2025,
      "started": false,
      "status": "played",
      "week": 16
    },
    {
      "fantasy_points": 0.0,
      "game_id": "2025_17_DET_MIN",
      "owner_roster_id": 10,
      "season": 2025,
      "started": false,
      "status": "did_not_play",
      "week": 17
    },
    {
      "fantasy_points": 7.98,
      "game_id": "2025_18_GB_MIN",
      "owner_roster_id": 10,
      "season": 2025,
      "started": false,
      "status": "played",
      "week": 18
    }
  ]
}
