{
  "current_owner": {
    "roster_id": 11,
    "team_name": "Sleeping Giants"
  },
  "gsis_id": null,
  "name": "Carson Schwesinger",
  "ownership_history": [
    {
      "bid": 0,
      "date": "2025-12-02",
      "event": "add",
      "roster_id": 11,
      "season": 2025,
      "via": "waiver"
    },
    {
      "event": "rostered",
      "from_week": 14,
      "roster_id": 11,
      "season": 2025,
      "to_week": 18
    }
  ],
  "player_id": "12578",
  "position": "LB",
  "season_aggregates": {
    "2025": {
      "best_week": {
        "owner_roster_id": 11,
        "points": 15.0,
        "week": 16
      },
      "total_fantasy_pts": 42.0,
      "weeks_played": 5,
      "weeks_rostered": 5,
      "weeks_started": 5,
      "worst_week": {
        "owner_roster_id": 11,
        "points": 0.0,
        "week": 18
      }
    }
  },
  "weekly": [
    {
      "fantasy_points": 11.0,
      "game_id": "2025_14_TEN_CLE",
      "owner_roster_id": 11,
      "season": 2025,
      "started": true,
      "status": "played",
      "week": 14
    },
    {
      "fantasy_points": 10.0,
      "game_id": "2025_15_CLE_CHI",
      "owner_roster_id": 11,
      "season": 2025,
      "started": true,
      "status": "played",
      "week": 15
    },
    {
      "fantasy_points": 15.0,
      "game_id": "2025_16_BUF_CLE",
      "owner_roster_id": 11,
      "season": 2025,
      "started": true,
      "status": "played",
      "week": 16
    },
    {
      "fantasy_points": 6.0,
      "game_id": "2025_17_PIT_CLE",
      "owner_roster_id": 11,
      "season": 2025,
      "started": true,
      "status": "played",
      "week": 17
    },
    {
      "fantasy_points": 0.0,
      "game_id": "2025_18_CLE_CIN",
      "owner_roster_id": 11,
      "season": 2025,
      "started": true,
      "status": "played",
      "week": 18
    }
  ]
}
